{
  "spec_id": "repo.repository-structure",
  "title": "Repository Structure",
  "purpose": "Defines the repository layout and top-level separation of concerns.",
  "status": "accepted",
  "schema_version": "1",
  "normative_requirements": [
    {
      "id": "REPO-STR-001",
      "text": "The repository shall separate repository-spec source, product-spec source, schemas, derived docs, and tooling into distinct top-level areas."
    }
  ],
  "dependencies": [
    {
      "spec_id": "repo.manifest"
    }
  ],
  "references": [
    {
      "type": "specification",
      "spec_id": "repo.manifest"
    },
    {
      "type": "artifact",
      "path": "docs/plans/00-bootstrap-plan.md"
    }
  ],
  "derived_artifacts": [
    {
      "type": "markdown",
      "path": "derived/specs/repo/repository-structure.md"
    }
  ]
}
