{
  "spec_id": "repo.product-overview",
  "title": "Product Overview Contract",
  "purpose": "Defines the directional, non-normative contract for product overview documents.",
  "status": "accepted",
  "schema_version": "1",
  "normative_requirements": [
    {
      "id": "REPO-POV-001",
      "text": "A product overview shall be stored under `docs/overview/` and shall use the canonical top-level `*-OVERVIEW.md` controlling document plus subordinate chunks."
    },
    {
      "id": "REPO-POV-002",
      "text": "A product overview shall record product identity, problem or opportunity, intended users or stakeholders, desired outcomes, scope, non-goals, product boundaries, durable principles, major capabilities, success conditions, unresolved product direction, predecessor evidence, and readiness for decomposition, with semantic coverage separated from subordinate chunk layout."
    },
    {
      "id": "REPO-POV-003",
      "text": "A product overview shall remain directional and non-normative and shall not define exact product behavior, accepted interfaces, accepted schemas, or release readiness."
    },
    {
      "id": "REPO-POV-004",
      "text": "The top-level controlling document shall act as the index, status declaration, and navigation entry point for the overview composite document."
    },
    {
      "id": "REPO-POV-005",
      "text": "A product overview may contain a concise summary, but the substantive directional content shall live in subordinate chunks, and a semantic area may span multiple chunks or share chunks with other areas."
    },
    {
      "id": "REPO-POV-006",
      "text": "A product overview shall expose unresolved product-direction questions rather than silently resolving them in later stages."
    },
    {
      "id": "REPO-POV-007",
      "text": "A product overview shall declare when it is ready for decomposition, but that readiness shall remain directional rather than constituting acceptance of normative behavior."
    }
  ],
  "dependencies": [
    {
      "spec_id": "repo.development-document-base"
    },
    {
      "spec_id": "repo.repository-structure"
    },
    {
      "spec_id": "repo.validation"
    }
  ],
  "references": [
    {
      "type": "specification",
      "spec_id": "repo.development-document-base"
    },
    {
      "type": "specification",
      "spec_id": "repo.repository-structure"
    },
    {
      "type": "specification",
      "spec_id": "repo.validation"
    },
    {
      "type": "artifact",
      "path": "docs/overview/PRODUCT-OVERVIEW.md"
    },
    {
      "type": "artifact",
      "path": "docs/overview/INITIALIZER-OVERVIEW.md"
    }
  ],
  "derived_artifacts": [
    {
      "type": "markdown",
      "path": "derived/specs/repo/product-overview.md"
    }
  ]
}
