{
  "spec_id": "repo.product-levels",
  "title": "Product Level Contract",
  "purpose": "Defines the normative Level 0-3 product-specification model and its dependency semantics.",
  "status": "accepted",
  "schema_version": "1",
  "normative_requirements": [
    {
      "id": "REPO-PL-001",
      "text": "The repository shall define `repo.product-levels` as the normative contract for the Level 0-3 product-specification model."
    },
    {
      "id": "REPO-PL-002",
      "text": "Level 0 shall define minimal product-wide semantics that govern the interpretation, identity, authority, lifecycle, or common constraints of otherwise independent product areas, and Level 0 specifications shall depend only on Level 0 specifications."
    },
    {
      "id": "REPO-PL-003",
      "text": "Level 1 shall define an independently meaningful product concept or elementary contract that can be understood without coordinating multiple coherent product responsibilities, and Level 1 specifications shall depend only on Level 0 or Level 1 specifications."
    },
    {
      "id": "REPO-PL-004",
      "text": "Level 2 shall define a reusable capability that composes primitives into one coherent product responsibility but does not itself establish a complete product outcome, and Level 2 specifications shall depend only on Level 0, Level 1, or Level 2 specifications."
    },
    {
      "id": "REPO-PL-005",
      "text": "Level 3 shall define a complete product outcome, use case, or lifecycle transition by coordinating one or more independently meaningful responsibilities, including observable success and failure behavior, and Level 3 specifications shall depend on Level 0, Level 1, Level 2, or Level 3 specifications."
    },
    {
      "id": "REPO-PL-006",
      "text": "Higher Levels may depend on the same or lower Levels, and lower Levels shall not depend on higher Levels."
    },
    {
      "id": "REPO-PL-007",
      "text": "Same-Level dependencies shall be permitted only when they are explicit and the full product dependency graph remains acyclic."
    },
    {
      "id": "REPO-PL-008",
      "text": "Product dependency targets shall be limited to candidate or accepted product specifications."
    },
    {
      "id": "REPO-PL-009",
      "text": "Accepted Level 1, Level 2, and Level 3 specifications shall require at least one accepted Level 0 specification, and intermediate Levels shall not be mandatory merely because a higher Level exists."
    },
    {
      "id": "REPO-PL-010",
      "text": "Each product specification shall remain confined to its reserved Level root, and Level metadata recorded in the manifest and product file shall agree with the declared Level root."
    },
    {
      "id": "REPO-PL-011",
      "text": "Future Level-specific schemas shall extend the common product-specification envelope through explicit governed extension boundaries and shall not redefine common fields or lower-Level semantics."
    },
    {
      "id": "REPO-PL-012",
      "text": "Structural completeness shall be machine-checkable from the declared Level, path correspondence, dependency targets, and lifecycle agreement, while semantic completeness remains review-owned."
    },
    {
      "id": "REPO-PL-013",
      "text": "Product projection declarations shall be declaration-driven rather than mandatory, and any declared product projection shall remain within the repository-relative `derived/specs/product/` root and subordinate to the owning product specification."
    }
  ],
  "dependencies": [
    {
      "spec_id": "repo.manifest"
    },
    {
      "spec_id": "repo.repository-structure"
    },
    {
      "spec_id": "repo.artifact-taxonomy"
    },
    {
      "spec_id": "repo.product-manifest"
    },
    {
      "spec_id": "repo.product-spec-base"
    },
    {
      "spec_id": "repo.validation"
    }
  ],
  "references": [
    {
      "type": "specification",
      "spec_id": "repo.manifest"
    },
    {
      "type": "specification",
      "spec_id": "repo.repository-structure"
    },
    {
      "type": "specification",
      "spec_id": "repo.artifact-taxonomy"
    },
    {
      "type": "specification",
      "spec_id": "repo.product-manifest"
    },
    {
      "type": "specification",
      "spec_id": "repo.product-spec-base"
    },
    {
      "type": "specification",
      "spec_id": "repo.validation"
    },
    {
      "type": "artifact",
      "path": "docs/plans/01-framework-architecture-plan.md"
    },
    {
      "type": "artifact",
      "path": "docs/overview/product-overview/03-development-and-specifications.md"
    },
    {
      "type": "artifact",
      "path": "docs/overview/product-overview/06-governance-and-evolution.md"
    }
  ],
  "derived_artifacts": [
    {
      "type": "markdown",
      "path": "derived/specs/repo/product-levels.md"
    }
  ]
}
