{
  "spec_id": "repo.product-decomposition",
  "title": "Product Decomposition Contract",
  "purpose": "Defines the directional, non-normative contract for product decomposition documents.",
  "status": "accepted",
  "schema_version": "1",
  "normative_requirements": [
    {
      "id": "REPO-PDC-001",
      "text": "A product decomposition shall be stored under `docs/decompositions/` and shall use the canonical top-level `*-DECOMPOSITION.md` controlling document plus subordinate chunks."
    },
    {
      "id": "REPO-PDC-002",
      "text": "A product decomposition shall record the controlling product overview, controlling documents, predecessor documents, evidence, bounded product areas, stable product-area identifiers, required content areas, permitted chunk roles, each area's purpose, responsibilities, boundaries, dependencies, exclusions, cross-cutting concerns, unresolved decisions, likely successor planning or specification work, decomposition stopping criteria, and the authorized next planning action."
    },
    {
      "id": "REPO-PDC-003",
      "text": "A product decomposition shall remain directional and non-normative and shall not define exact product behavior, select implementation architecture without later authority, accept product specifications, or conceal unresolved semantic decisions."
    },
    {
      "id": "REPO-PDC-004",
      "text": "The top-level controlling document shall act as the index, status declaration, and navigation entry point for the decomposition composite document."
    },
    {
      "id": "REPO-PDC-005",
      "text": "A product decomposition shall keep each bounded area coherent and shall not mix unrelated lifecycle stages or authority domains within one area."
    },
    {
      "id": "REPO-PDC-006",
      "text": "A product decomposition shall make the next authorized planning action explicit so later work does not have to infer it from conversation history."
    }
  ],
  "dependencies": [
    {
      "spec_id": "repo.development-document-base"
    },
    {
      "spec_id": "repo.repository-structure"
    },
    {
      "spec_id": "repo.validation"
    }
  ],
  "references": [
    {
      "type": "specification",
      "spec_id": "repo.development-document-base"
    },
    {
      "type": "specification",
      "spec_id": "repo.repository-structure"
    },
    {
      "type": "specification",
      "spec_id": "repo.validation"
    },
    {
      "type": "artifact",
      "path": "docs/decompositions/INITIALIZER-DECOMPOSITION.md"
    }
  ],
  "derived_artifacts": [
    {
      "type": "markdown",
      "path": "derived/specs/repo/product-decomposition.md"
    }
  ]
}
